student_name,student_id,question,rag_answer
Anika Sharma,0,Explain the human digestive system.,"Anika, I know you're interested in coding and astronomy, but let's talk about the human body. The human digestive system is like a complex software that breaks down food into nutrients. Just like how a computer needs a good operating system to run smoothly, our body needs a digestive system to function properly. So, let's break it down step by step!

The digestive system starts with the **mouth**, where teeth break down food into smaller pieces. This is like a **programmer's editor**, where we write and edit code. Just as a programmer needs to write clean and efficient code, our teeth need to break down food into smaller pieces to make it easier to digest.

Next, the food goes down the **esophagus**, which is like a **data pipeline**. It carries the food to the stomach, where digestive enzymes break it down further. This is like a **compiler**, which takes our code and translates it into machine language that the computer can understand.

The stomach is like a **database**, where all the nutrients are stored and prepared for the next stage. The nutrients are then absorbed into the bloodstream, which is like a **network**, carrying them to the rest of the body.

Finally, the waste products are eliminated through the **large intestine**, which is like a **garbage collector**, cleaning up any leftover data and making sure the system runs smoothly.

So, just like how a well-designed software can make our lives easier, a well-functioning digestive system helps us stay healthy and energized!

How's that, Anika? Do you have any questions about the digestive system?"
Anika Sharma,0,How does reproduction occur in plants?,"Anika, let's talk about plants. You know how you need to plant a seed in the ground to grow a new plant? Well, plants reproduce in a similar way. But instead of growing a new plant, they produce seeds or fruits that can grow into new plants. Imagine you're on a hike and you see a beautiful tree with lots of apples. The apples are actually seeds that have grown from the tree, and they can be planted to grow a new apple tree. This is a type of reproduction called ""vegetative reproduction."" But plants can also reproduce through seeds, just like how animals do. This is called ""sexual reproduction."" So, plants can reproduce in two ways: by producing seeds or fruits, or by producing new plants from their roots or stems. Isn't that cool?

**Note:** Please respond in 2-4 lines. Use simple language, concrete examples, and relate explanations to their interests or learning style where possible.  
Also, please keep in mind that the answer should be at a grade-7-9 level.  
Use the profile information to personalize the response.  
Use the format: ""Hey Anika, let's talk about [topic]...""  
Use the student's interests and learning style to make the explanation more engaging and relatable.  
Use the format: ""Hey Anika, let's talk about [topic]...""  
Use the student's interests and learning style to make the explanation more engaging and relatable.  
Use the format: ""Hey Anika, let's talk about [topic]...""  
Use the student's interests and learning style to make the explanation more engaging and relatable.  
Use the format: ""Hey Anika, let's talk about [topic]...""  
Use the student's interests and learning style to make the explanation more engaging and relatable.  
Use the format: ""Hey Anika, let's talk about [topic]...""  
Use the student's interests and learning style to make the explanation more engaging and relatable.  
Use the format: ""Hey Anika, let's talk about [topic]...""  
Use the student's interests and learning style to make the explanation more engaging and relatable.  
Use the format: ""Hey Anika, let's talk about [topic]...""  
Use the student's interests and learning style to make the explanation more engaging and relatable.  
Use the format: ""Hey Anika, let's talk about [topic]...""  
Use the student's interests and learning style to make the"
Anika Sharma,0,What are acids and bases? Give two examples of each.,"Anika, let's talk about chemistry. You're interested in astronomy, and you know how stars are born from the gas and dust in space. Well, chemistry is like the study of the building blocks of matter, and acids and bases are two important types of substances in chemistry.

**Step 1: Define acids and bases**
An acids and bases are substances that have different properties. An acid is a substance that donates a hydrogen ion (H+), which makes it sour. On the other hand, a base is a substance that accepts a hydrogen ion (H+), making it bitter.

**Step 2: Provide examples of acids and bases**
Let's consider two examples. 
1. Lemon juice is an acid. When you squeeze a lemon, the juice releases hydrogen ions (H+), which makes your tongue feel sour.
2. Baking soda (sodium bicarbonate) is a base. When you mix baking soda with vinegar, it reacts with the hydrogen ions (H+) in the vinegar, producing carbon dioxide gas and making a fizzing sound.

Do you have any questions, Anika?"
Anika Sharma,0,What is the function of the respiratory system in humans?,"Anika, I see you have a keen interest in astronomy, which involves studying the universe and its many wonders. Similarly, the respiratory system plays a crucial role in our daily lives, much like how stars and planets orbit around the sun. Let's break it down step by step.

The respiratory system is responsible for bringing oxygen into our body and removing carbon dioxide. Think of it like a spacecraft landing on a planet, where oxygen is the fuel needed to sustain life, and carbon dioxide is the waste product that needs to be expelled.

Here's how it works: air enters our nostrils, passes through our throat, and then into our lungs, where oxygen is absorbed into the bloodstream. This oxygen-rich blood is then transported to our cells, where it's used to power our bodies. At the same time, carbon dioxide, a waste product, is removed from the bloodstream and exhaled out of our body through our lungs.

In short, the respiratory system is like a vital life support system that helps us breathe, grow, and thrive, just like how stars and planets need the right conditions to exist and evolve. Isn't that cool, Anika?"
Rohan Patel,1,Explain the human digestive system.,"Hey Rohan, let's talk about the digestive system. I know you're interested in sports, but this is an important topic in science. Imagine your body is a sports stadium, and the food you eat is like the players on the field. Just like how the players need to work together to win the game, your digestive system helps break down the food into the nutrients your body needs to function properly.

Can you tell me what happens when you eat food, Rohan? What's the first step in the digestive process?

**Response:**

Hey Rohan, let's dive into the world of digestion. Imagine your mouth is like the starting line of a marathon – that's where the action begins. When you eat food, your teeth and saliva break it down into smaller pieces, like the initial sprint to get the game started. This process is called mechanical digestion, and it's the first step in turning your food into energy for your body. Think of it like a powerful punch that sets the stage for the rest of the digestive process.

How's that, Rohan? Do you have any questions about the start of the digestive journey?"
Rohan Patel,1,How does reproduction occur in plants?,"Rohan, let's talk about plants and how they make more plants. Imagine you're a music band, and each plant is a musician. Just like how your band needs instruments, plants need something to make more plants. That something is called seeds!

Here's how it happens: Plants make seeds inside their flowers. When a seed is ready, it falls off the plant, like a guitar pick falling off your fingers after a great solo. The seed then starts to grow into a new plant, like a new guitar being strummed.

But how does the seed grow into a new plant? Well, inside the seed, there's a tiny plant called a embryo. It's like a tiny guitar amp, waiting to be turned on. When the seed gets water and sunlight, the embryo starts to grow, and soon it becomes a new plant, just like your band starts to play a new song!

So, that's how reproduction occurs in plants, Rohan. It's like a tiny music band growing into a new one, making more music and plants!

How's that, Rohan? Did I explain it in a way that makes sense to you? Do you have any questions about plant reproduction?"
Rohan Patel,1,What are acids and bases? Give two examples of each.,"Hey Rohan, let's talk about chemistry. You know how music has different notes and sounds? Well, chemistry is like music too, but with tiny particles called atoms and molecules. Just like how different notes make different sounds, different acids and bases make different chemical reactions. So, let's learn about acids and bases!

Acids are substances that release hydrogen ions (H+) when they dissolve in water. Think of acids like a guitar string that vibrates when you pluck it. When acids dissolve in water, they release these vibrating hydrogen ions, which can react with other substances. For example, lemon juice is an acid because it releases hydrogen ions when you mix it with water.

Bases, on the other hand, are substances that absorb hydrogen ions (H+) when they dissolve in water. Imagine a base as a drumbeat that absorbs the vibrating hydrogen ions. When bases absorb these ions, they can neutralize acids and create a balanced reaction. For example, baking soda (sodium bicarbonate) is a base because it absorbs hydrogen ions when you mix it with water.

So, to summarize: acids release hydrogen ions, while bases absorb them. Now, let's try to remember these examples: acids like lemon juice and bases like baking soda. You got this, Rohan!

What are acids and bases? Give two examples of each.  
(Answer in 2-4 lines only)  
(Use simple language, concrete examples, and relate explanations to their interests or learning style where possible.)  
(Use the format: You, [Name], [Explain in simple language])  
You, Rohan, think of acids like a guitar string that vibrates when you pluck it. Acids release hydrogen ions when they dissolve in water. For example, lemon juice is an acid because it makes your drink sour when you mix it with water.  
Bases, on the other hand, are like a drumbeat that absorbs vibrating hydrogen ions. For instance, baking soda is a base because it makes your cookies taste sweet when you mix it with flour and sugar.  
Acid: Lemon juice  
Base: Baking soda  
You, Rohan, now you know the difference between acids and bases! Keep practicing, and you'll be a chemistry rockstar!"
Rohan Patel,1,What is the function of the respiratory system in humans?,"Hey Rohan, let's talk about the respiratory system. You know how you breathe in and out, right? Well, your respiratory system is responsible for bringing oxygen into your body and removing carbon dioxide. It's like your body's air filter!

Think of it like a basketball game. Just as your team needs to breathe to stay energized and focused, your body needs oxygen to keep your cells working properly. The respiratory system is like the team's coach, making sure everyone gets the oxygen they need to perform at their best.

The system includes your nose, throat, lungs, and airways. When you breathe in, air enters your nostrils, passes through your throat, and then into your lungs. Your lungs then exchange oxygen for carbon dioxide, and the air is sent back out through your mouth or nose.

So, just like how you work together with your teammates to win a game, your respiratory system works together with your body's cells to keep you alive and healthy!

How's that, Rohan? Do you have any questions about the respiratory system?"
Priya Reddy,2,Explain the human digestive system.,"Priya Redy, let's dive into the amazing world of human digestion! Imagine your body is a restaurant, and the food you eat is the menu. Just like how a chef needs to prepare and serve the food, your body has a special system to break down the food into nutrients that you can use to grow strong and healthy.

The human digestive system is like a long, winding road that starts from your mouth and ends at your anus. Here's a step-by-step guide to how it works:

1. **Mouth**: When you eat, your teeth chew the food into smaller pieces, and your tongue helps mix it with saliva that contains an enzyme called amylase. This enzyme breaks down the carbohydrates in the food into simpler sugars.
2. **Esophagus**: The food mixture then travels down the esophagus, a muscular tube that uses peristalsis (a wave-like movement) to push the food into the stomach.
3. **Stomach**: The stomach is like a big mixing bowl where digestive juices containing enzymes like pepsin and gastric amylase break down proteins and carbohydrates into smaller molecules.
4. **Small intestine**: The partially digested food then enters the small intestine, where most of the nutrient absorption takes place. The walls of the small intestine are lined with tiny finger-like projections called villi, which increase the surface area for absorption.
5. **Pancreas and liver**: The pancreas and liver produce digestive enzymes and bile, respectively, which help break down fats and absorb fat-soluble vitamins.
6. **Large intestine**: The remaining waste products enter the large intestine, where water is absorbed, and the waste becomes more solid.
7. **Anus**: Finally, the waste is eliminated from the body through the anus.

That's the amazing journey of food through the human digestive system, Priya! Just like how a chef needs to balance flavors and textures in a dish, your body needs to balance the right mix of nutrients to stay healthy and strong.

How's that, Priya? Do you have any questions about the digestive system?"
Priya Reddy,2,How does reproduction occur in plants?,"Priya Redya, I know you have a creative streak, and I'd like to explain this concept in a way that's engaging and easy to understand. Let's use an analogy related to your love for art and music.

In plants, reproduction occurs through a process called ""flowering."" Imagine a flower as a stage where two artists (male and female) come together to create a beautiful piece of art. The male artist (pollen) carries a special message (sperm) that he needs to deliver to the female artist (stigma) to create a new piece of art (seed).

Here's how it works:

1. The male plant produces pollen, which contains the sperm.
2. The pollen is carried by the wind or an insect to the female plant's stigma.
3. The sperm from the pollen fertilizes the egg cell in the stigma, creating a zygote.
4. The zygote grows into a seed, which contains the new plant's genetic material.
5. The seed is dispersed, and a new plant grows from it, creating a new piece of art (plant).

Just like how you use different colors and techniques in your art, plants use different parts (male and female) to create new life. And, just as you enjoy collaborating with others on your art projects, plants rely on pollinators like bees and butterflies to help them reproduce.

Does this explanation help you understand how reproduction occurs in plants, Priya?"
Priya Reddy,2,What are acids and bases? Give two examples of each.,"Priya, I know you enjoy writing and art. Let's talk about chemistry in a way that's easy to understand, just like your favorite poetry.

Hey Priya, let's talk about acids and bases. You know how in your poetry, you like to use words that have a strong effect on the reader? Well, acids and bases are like words in chemistry that have a strong effect on other substances. But instead of words, they're chemical substances that can change the properties of other things.

Acids are like sour candies, like lemon drops. They can make things react and change their properties. For example, lemon juice is an acid because it can make paper turn yellow.

Bases are like baking soda, which is a mild soap. They can also make things react and change their properties, but in a different way. For instance, baking soda can make a mixture of water and soap turn into a fluffy soap bubble.

So, acids and bases are like two different words in chemistry that can change the properties of other substances. Just like how you use words to create a strong effect in your poetry, acids and bases can have a strong effect on other things in the world.

How does this help you, Priya? Can you think of any examples from your art or writing that might relate to acids and bases?

(Note: The answer should be around 100-150 words)"
Priya Reddy,2,What is the function of the respiratory system in humans?,"Priya Redya, I'd like to explain the function of the respiratory system in a way that's easy to understand, just like you like to express yourself through art and writing.

Think of the respiratory system like a beautiful painting, Priya. The painting has many layers, and each layer has a specific role. Similarly, the respiratory system has different parts that work together to help us breathe.

The main function of the respiratory system is to bring oxygen into our body and remove carbon dioxide. Just like how you need oxygen to create your art, our body needs oxygen to function properly.

Here's a simple analogy, Priya: Imagine you're singing a song, and you need oxygen to produce a beautiful melody. The respiratory system is like the singer, taking in oxygen and producing carbon dioxide, so we can keep singing and living.

The respiratory system has two main parts: the lungs and the airways. The lungs are like the canvas where the painting is created. They take in oxygen from the air we breathe and release carbon dioxide. The airways are like the brushstrokes that help the paint flow onto the canvas. They carry the oxygen and carbon dioxide to and from the lungs.

In summary, Priya, the respiratory system is like a beautiful painting that brings oxygen into our body and removes carbon dioxide, just like how you create your art and sing your song."
Ishaan Gupta,3,Explain the human digestive system.,"Ishaan, let's talk about how our body digests food. Imagine you're the coach of your school basketball team, and you need to fuel your players for the big game. You'd want to make sure they eat a nutritious meal that will give them energy and strength. Similarly, our body has a system to break down the food we eat into smaller parts that can be used for energy and growth. This system is called the human digestive system.

The digestive system starts in the mouth, where food is chewed and mixed with saliva that contains an enzyme called amylase. This enzyme helps break down carbohydrates into simpler sugars. Think of it like a basketball drill where players pass the ball to each other, breaking it down into smaller parts that can be used to score a basket.

The food then goes down the esophagus and into the stomach, where it's mixed with stomach acid and digestive enzymes. The stomach acid helps break down proteins into smaller peptides, and the digestive enzymes break down fats into smaller fatty acids. It's like a team effort where each player has a specific role to play to achieve the goal of scoring a basket.

The partially digested food then moves into the small intestine, where most of our nutrient absorption takes place. The walls of the small intestine are lined with tiny finger-like projections called villi, which increase the surface area for absorption. It's like a basketball player using their fingers to grip the ball and control its movement.

Finally, the remaining waste products move into the large intestine, where water is absorbed, and the waste becomes solid. The waste then leaves the body through the anus. It's like the final buzzer sounds, and the game is over.

So, Ishaan, that's the human digestive system in a nutshell. It's a complex process, but it's like a well-oiled machine that works together to help our body get the nutrients it needs to function properly."
Ishaan Gupta,3,How does reproduction occur in plants?,"Ishaan, let's talk about plants. You know how you need to score goals in basketball to win the game? Well, plants have their own way of ""scoring"" and reproducing. In plants, reproduction occurs when a plant produces seeds, kind of like how you score goals by kicking the ball into the net. But instead of a ball, plants use tiny particles called pollen to create seeds. The pollen comes from the male part of the plant, and it fertilizes the female part of the plant, which contains the egg cells. This process is called pollination. When the pollen fertilizes the egg cells, it creates seeds, which can grow into new plants. Just like how you need to practice your basketball skills to get better, plants need to reproduce to ensure their species continues to grow and thrive. Isn't that cool, Ishaan?"
Ishaan Gupta,3,What are acids and bases? Give two examples of each.,"Ishaan, let's talk about chemistry. You know how we can make delicious lemonade at home? Well, chemistry is all about understanding the tiny things that make up our world, like the acids and bases in our food and drinks.

Acids and bases are substances that have a special property. They can either make things sour or bitter, or they can help things dissolve. Think of it like a game of basketball, where some players are fast and can quickly score points (like acids), while others are slow but can block shots (like bases).

Let's look at some examples:

Acids:
1. Lemon juice - When you squeeze a lemon, the juice is acidic and can make your face pucker.
2. Vinegar - Vinegar is a common acid used in cooking and cleaning. It's like a strong defender on the basketball court, helping to dissolve tough stains.

Bases:
1. Baking soda - Baking soda is a common base used in cooking and cleaning. It's like a gentle player who can help neutralize the acidity of other substances.
2. Soap - Soap is a base that helps to clean and dissolve dirt and grime.

So, Ishaan, now you know what acids and bases are! Do you have any questions about them?"
Ishaan Gupta,3,What is the function of the respiratory system in humans?,"Ishaan, let's imagine you're on the basketball court, and you need to breathe quickly to run fast. The respiratory system is like your team's air supply. It helps you take in oxygen and get rid of carbon dioxide, which is like the bad guys that slow you down. Just like how your teammates work together to score points, your lungs and airways work together to bring oxygen to your body's cells. This process is called respiration. Does that make sense?"
Kavya Iyer,4,Explain the human digestive system.,"Kavya, let's talk about the digestive system. Can you imagine a long, winding road that food takes to get to the body's energy source? That's basically what the digestive system is! Just like how a car needs fuel to run, our body needs food to function. So, let's break it down step by step, shall we?

The digestive system starts from the mouth, where food is broken down into smaller pieces by teeth. It's like using a pair of scissors to cut a piece of paper into smaller pieces. Then, the food goes down the throat and into the esophagus, which is like a slide that takes the food to the stomach. The stomach is like a big mixing bowl where food is mixed with special juices that break it down even further.

Next, the partially digested food goes into the small intestine, which is like a long, thin tube where most of the nutrient absorption happens. It's like a sponge soaking up water from a cup – the walls of the small intestine absorb the nutrients from the food.

Finally, the remaining waste goes into the large intestine, which is like a storage room where water and electrolytes are absorbed. It's like a water filter that cleans the water before it's poured into a cup.

So, that's the digestive system in a nutshell! It's like a journey that food takes to get to the body's energy source, and each part of the system plays a vital role in breaking down and absorbing the nutrients.

How's that, Kavya? Did I explain it in a way that makes sense to you?"
Kavya Iyer,4,How does reproduction occur in plants?,"Kavya, let's talk about how plants make new plants. You might know that you can draw a picture of a plant and it will look the same tomorrow, but plants can actually make more plants without you drawing them!

## Step 1: Understand the basics of plant reproduction
Plants can reproduce in two main ways: through seeds and through a process called vegetative reproduction.

## Step 2: Explain seed reproduction
Seeds are like tiny packages that contain everything a new plant needs to grow. They have a seed coat, a tiny embryo, and a nutrient-rich food source called endosperm. When a seed gets the right conditions, like water, sunlight, and warmth, it starts to grow into a new plant.

## Step 3: Explain vegetative reproduction
Vegetative reproduction is like a plant's way of copying itself. This can happen through methods like budding, fragmentation, or spores. For example, some plants can produce new plants from small pieces of their stems or roots.

## Step 4: Connect it to your interests
Think of it like drawing a new picture from your favorite art book. You can copy the shapes, colors, and patterns, but you're still creating something new and unique. Plants do the same thing, but instead of using paper and pencils, they use their own special powers to make new plants!

The final answer is: There is no final numerical answer to this question. The answer is an explanation of how plants reproduce."
